{"agent_task_view_hash":"sha256:d5e64444e9219da734aa89d96a079edfcf3623ac84ce566cc060cc546f71fbb5","blind_review":{"decision":"accepted","reviewed_at":"2026-07-29T00:00:00Z","reviewer":"blind-reviewer-v07-independent-01"},"content_hash":"sha256:ff80b9a47c555d56a5de4b638f6f6ac5a8b039f93f7ee84761090fb42d38df12","contract_type":"prompt_quality","created_at":"2026-07-29T00:00:00Z","decision":"accepted","findings":[],"prompt_hash":"sha256:3f46e67cf231b1763d69b748c7c2c89287fa20c69a8a20fa295c8a2a095c86fc","public_task_id":"opbench-v07-t0015","scanner_version":"prompt-overlap-v1","schema_version":"v1","semantic_review":{"decision":"equivalent","reviewed_at":"2026-07-29T00:00:00Z","reviewer":"semantic-reviewer-v07-independent-01"},"task_id":"pytorch__144009__softmax_ilpreduce_size"}