{"agent_task_view_hash":"sha256:9f3764e06bd3ae7b7e111351eab3a11b6889c7c97fe5c16e8cbbdb555a62fb03","blind_review":{"decision":"accepted","reviewed_at":"2026-08-10T16:25:00Z","reviewer":"codex-primary-public-blind-batch11-final-v07"},"content_hash":"sha256:61eaf50402c9fece1fa6788b8d0b525b8cd79e1e62e6099f0ca4963bed07eb09","contract_type":"prompt_quality","created_at":"2026-08-10T16:25:03Z","decision":"accepted","findings":[],"prompt_hash":"sha256:aff6e68a840701db98a67abbf8e9854e9380a4035655dfbea512c4b25afb59cd","public_task_id":"opbench-v07-t0058","scanner_version":"prompt-overlap-v2","schema_version":"v1","semantic_review":{"decision":"equivalent","reviewed_at":"2026-08-10T16:25:01Z","reviewer":"codex-primary-private-semantic-batch11-final-v07"},"task_id":"pytorch__178667__semi_structured_cpu_conversion"}