{"agent_task_view_hash":"sha256:bb4480f868b83d0a90d8e81daca471417aa611219ff7931aec350d1ad196a5c0","blind_review":{"decision":"accepted","reviewed_at":"2026-08-10T16:25:00Z","reviewer":"codex-primary-public-blind-batch11-final-v07"},"content_hash":"sha256:8e3d818e4c94ab30960d5e8102b63f41d37d6421e35d3a86b968346a9bc462fe","contract_type":"prompt_quality","created_at":"2026-08-10T16:25:03Z","decision":"accepted","findings":[],"prompt_hash":"sha256:45a43a70569078bf524f77f4b4fa233e9b7ab297a325702781a9bebb06fc5ee1","public_task_id":"opbench-v07-t0057","scanner_version":"prompt-overlap-v2","schema_version":"v1","semantic_review":{"decision":"equivalent","reviewed_at":"2026-08-10T16:25:01Z","reviewer":"codex-primary-private-semantic-batch11-final-v07"},"task_id":"pytorch__179481__identity_optimization_hint"}