{"agent_task_view_hash":"sha256:e1c0bbfacddbe4545a0a1b005628406e83743520d881f59db1335764fbe494ff","blind_review":{"decision":"accepted","reviewed_at":"2026-07-29T00:00:00Z","reviewer":"blind-reviewer-v07-independent-01"},"content_hash":"sha256:22c3cbd5e6dcfbe8504336ec32d958f44fcc050012116427d7d3fd6d9a0ccd27","contract_type":"prompt_quality","created_at":"2026-07-29T00:00:00Z","decision":"accepted","findings":[],"prompt_hash":"sha256:f22a8579f617cdc8792e30010ec2a21a7727a18537f53a5df8e18ac8397a2d02","public_task_id":"opbench-v07-t0007","scanner_version":"prompt-overlap-v1","schema_version":"v1","semantic_review":{"decision":"equivalent","reviewed_at":"2026-07-29T00:00:00Z","reviewer":"semantic-reviewer-v07-independent-01"},"task_id":"pytorch__132616__cuda_mem_get_info"}