{"agent_task_view_hash":"sha256:69d4514a5eb47ed791174a4da8c147b93e05f8ffe7fa9a0c5e81a6fd32006799","blind_review":{"decision":"accepted","reviewed_at":"2026-07-29T00:00:00Z","reviewer":"blind-reviewer-v07-independent-01"},"content_hash":"sha256:fb8b91347ee21309eb41e402222ffcfabf7c0cb47d37f991ead7e761c62823e8","contract_type":"prompt_quality","created_at":"2026-07-29T00:00:00Z","decision":"accepted","findings":[],"prompt_hash":"sha256:b88d4e9b54e46f29d02ec724947b1793c86a0ab2e4271b58bdd75281efbacc58","public_task_id":"opbench-v07-t0016","scanner_version":"prompt-overlap-v1","schema_version":"v1","semantic_review":{"decision":"equivalent","reviewed_at":"2026-07-29T00:00:00Z","reviewer":"semantic-reviewer-v07-independent-01"},"task_id":"pytorch__144073__vector_norm_scalar_overflow"}