{"agent_task_view_hash":"sha256:7307658745200f808e20e8282e52bad9862277b9d704a2223f9ca14fe086d125","blind_review":{"decision":"accepted","reviewed_at":"2026-07-29T00:00:00Z","reviewer":"blind-reviewer-v07-independent-01"},"content_hash":"sha256:b72d57872f097bdd1aef751f85a8b0ef3f5d384a53fd325c60ecca6a6199d117","contract_type":"prompt_quality","created_at":"2026-07-29T00:00:00Z","decision":"accepted","findings":[],"prompt_hash":"sha256:841bf2d83916f6663edef62a352a69a7068ef55e27c5389ae8c0e992d6daba3f","public_task_id":"opbench-v07-t0020","scanner_version":"prompt-overlap-v1","schema_version":"v1","semantic_review":{"decision":"equivalent","reviewed_at":"2026-07-29T00:00:00Z","reviewer":"semantic-reviewer-v07-independent-01"},"task_id":"pytorch__150975__autograd_backward_inputs"}