{"agent_task_view_hash":"sha256:4393b24491f277a8d9be5165f269808d5e9cd7785f7520d16055a3bb3cf6c595","blind_review":{"decision":"accepted","reviewed_at":"2026-08-10T16:25:00Z","reviewer":"codex-primary-public-blind-batch11-final-v07"},"content_hash":"sha256:c91200937d5e1b2f33bbb8a3a9d73f29a2ed8a00d0d1dac1f8f3e6f3cd2a91bd","contract_type":"prompt_quality","created_at":"2026-08-10T16:25:03Z","decision":"accepted","findings":[],"prompt_hash":"sha256:a82c3071727d1e4be8b00812d2b9d6e635d11909bdd76fa561db257bac640599","public_task_id":"opbench-v07-t0041","scanner_version":"prompt-overlap-v2","schema_version":"v1","semantic_review":{"decision":"equivalent","reviewed_at":"2026-08-10T16:25:01Z","reviewer":"codex-primary-private-semantic-batch11-final-v07"},"task_id":"pytorch__186481__scatter_rewrite_dtype"}