{"agent_task_view_hash":"sha256:4f951940464bca9ac7ab7c31cacd4cb80ba1e2f53bf223723f582e7ab3b7be37","blind_review":{"decision":"accepted","reviewed_at":"2026-08-10T16:25:00Z","reviewer":"codex-primary-public-blind-batch11-final-v07"},"content_hash":"sha256:c9e6027fcc3ea167915aa960d9df0ce916abca4ed6fed487dd2c3471e70bef8f","contract_type":"prompt_quality","created_at":"2026-08-10T16:25:03Z","decision":"accepted","findings":[],"prompt_hash":"sha256:1c88569ca7dac34c44a8f058661136abb811ab59fb790b33c516a43268f839d3","public_task_id":"opbench-v07-t0050","scanner_version":"prompt-overlap-v2","schema_version":"v1","semantic_review":{"decision":"equivalent","reviewed_at":"2026-08-10T16:25:01Z","reviewer":"codex-primary-private-semantic-batch11-final-v07"},"task_id":"pytorch__182825__lazy_scratch_grid_extent"}