{"agent_task_view_hash":"sha256:4aacbfc28d85e40f0fb5522334cbd85298cd3e68b6ecce44f40fe701e794edf2","blind_review":{"decision":"accepted","reviewed_at":"2026-07-29T00:00:00Z","reviewer":"blind-reviewer-v07-independent-01"},"content_hash":"sha256:baeb821e60ecf7b9215b1400995cb6d582089dcb253d4cfa3c7a374f74421536","contract_type":"prompt_quality","created_at":"2026-07-29T00:00:00Z","decision":"accepted","findings":[],"prompt_hash":"sha256:bb323d34cfd11318c9af86b57177be1d0c7421d0d0407f6fbd6f0fce557cdc2b","public_task_id":"opbench-v07-t0005","scanner_version":"prompt-overlap-v1","schema_version":"v1","semantic_review":{"decision":"equivalent","reviewed_at":"2026-07-29T00:00:00Z","reviewer":"semantic-reviewer-v07-independent-01"},"task_id":"pytorch__129138__linear_add_bias_autocast"}