{"agent_task_view_hash":"sha256:404beb16f5ead502da436f0a8b6c30256dfc00b8f0a79119a45f6b7b91b86025","blind_review":{"decision":"accepted","reviewed_at":"2026-08-10T16:25:00Z","reviewer":"codex-primary-public-blind-batch11-final-v07"},"content_hash":"sha256:3425467f29ef57c545d98c00cea0fe509e00e6a1ee1479fa7fc05ab567090408","contract_type":"prompt_quality","created_at":"2026-08-10T16:25:03Z","decision":"accepted","findings":[],"prompt_hash":"sha256:37e14cd916770a74969e8d3e3b69950819a403ec143fedcfe14d3cca9f4c45fd","public_task_id":"opbench-v07-t0040","scanner_version":"prompt-overlap-v2","schema_version":"v1","semantic_review":{"decision":"equivalent","reviewed_at":"2026-08-10T16:25:01Z","reviewer":"codex-primary-private-semantic-batch11-final-v07"},"task_id":"pytorch__179333__template_index_width"}