{"agent_task_view_hash":"sha256:382a744bdfae275211541db07bdfbdc38acd941439e0ce97e6980087ccf63001","blind_review":{"decision":"accepted","reviewed_at":"2026-08-10T16:25:00Z","reviewer":"codex-primary-public-blind-batch11-final-v07"},"content_hash":"sha256:c8eab794803bd739ae33948e719451501f7cc3fb5c965eb6d00f19cd1f61d345","contract_type":"prompt_quality","created_at":"2026-08-10T16:25:03Z","decision":"accepted","findings":[],"prompt_hash":"sha256:c3d6663134d01aa116fe2baad291fe99bd6a9e5de2784fbeac081ec25460c7f1","public_task_id":"opbench-v07-t0060","scanner_version":"prompt-overlap-v2","schema_version":"v1","semantic_review":{"decision":"equivalent","reviewed_at":"2026-08-10T16:25:01Z","reviewer":"codex-primary-private-semantic-batch11-final-v07"},"task_id":"pytorch__188485__undefined_tensor_boxing"}