{"agent_task_view_hash":"sha256:ef00793cd67f80e9a92572c013f5cdf6c306d32b0d6c5f8338a9763b7120ae06","blind_review":{"decision":"accepted","reviewed_at":"2026-07-29T00:00:00Z","reviewer":"blind-reviewer-v07-independent-01"},"content_hash":"sha256:92fb99f261a8dfb079befdb9872fee2640b8cd137c348bb740c6987e377e6870","contract_type":"prompt_quality","created_at":"2026-07-29T00:00:00Z","decision":"accepted","findings":[],"prompt_hash":"sha256:f261158034bd306540209b71d1277aeda618fc3d83ecebeacd3bc68862df0f6c","public_task_id":"opbench-v07-t0025","scanner_version":"prompt-overlap-v1","schema_version":"v1","semantic_review":{"decision":"equivalent","reviewed_at":"2026-07-29T00:00:00Z","reviewer":"semantic-reviewer-v07-independent-01"},"task_id":"pytorch__168295__autograd_create_graph"}