{"agent_task_view_hash":"sha256:d2b715f374f862ad0eed21605dd4f234abe4da946b82106ab8ff3fb9040ede37","blind_review":{"decision":"accepted","reviewed_at":"2026-08-03T11:00:00Z","reviewer":"task9-pr179401-blind-prompt-reviewer"},"content_hash":"sha256:36f1fcaa0431157ec5abc952500589257e32c3502d4208d8538e5f264bbc5d5c","contract_type":"prompt_quality","created_at":"2026-08-03T11:02:00Z","decision":"accepted","findings":[],"prompt_hash":"sha256:45b59b58edf89784452e924614d7d2a3ffbc1269ce8a839cbfbabf9e11c8660a","public_task_id":"opbench-v07-t0029","scanner_version":"prompt-overlap-v1","schema_version":"v1","semantic_review":{"decision":"equivalent","reviewed_at":"2026-08-03T11:02:00Z","reviewer":"task9-pr179401-semantic-reviewer"},"task_id":"pytorch__179401__fake_unique_aux_metadata"}