{"agent_task_view_hash":"sha256:aac8cdd317441548a1bfb64bed8e7089cf9b1d00d8dfd505e9c226cf34918789","blind_review":{"decision":"accepted","reviewed_at":"2026-08-10T16:25:00Z","reviewer":"codex-primary-public-blind-batch11-final-v07"},"content_hash":"sha256:ca253dd5f39fea04a693540bc2b576bfa4d1cdc19ab2456c7b0e61d6c9241ee1","contract_type":"prompt_quality","created_at":"2026-08-10T16:25:03Z","decision":"accepted","findings":[],"prompt_hash":"sha256:3d6f181a808ea520828c73c775313e269db76a59098f9634f95246a3a10bf8e6","public_task_id":"opbench-v07-t0062","scanner_version":"prompt-overlap-v2","schema_version":"v1","semantic_review":{"decision":"equivalent","reviewed_at":"2026-08-10T16:25:01Z","reviewer":"codex-primary-private-semantic-batch11-final-v07"},"task_id":"pytorch__186993__large_guard_materialization"}