{"agent_task_view_hash":"sha256:ab49ec01619a9a1be50eaab87f0820ec10937f46639ac09e52bbbcda2ccd0c3b","blind_review":{"decision":"accepted","reviewed_at":"2026-07-29T00:00:00Z","reviewer":"blind-reviewer-v07-independent-01"},"content_hash":"sha256:0f67451a7262a7902aa51e7c6565c22eb273846b32440eb03edf1128ced7ac7e","contract_type":"prompt_quality","created_at":"2026-07-29T00:00:00Z","decision":"accepted","findings":[],"prompt_hash":"sha256:cae14009c875da096a69a1e5d89747490774af6e37b05ffcb27bf97b98ae00b2","public_task_id":"opbench-v07-t0013","scanner_version":"prompt-overlap-v1","schema_version":"v1","semantic_review":{"decision":"equivalent","reviewed_at":"2026-07-29T00:00:00Z","reviewer":"semantic-reviewer-v07-independent-01"},"task_id":"pytorch__143455__set_submodule"}